"Numeric_Based on your overall experience, how would you evaluate Home Credit and its products and services?",What is the primary reason for your score?,"To what extent would you recommend Home Credit to your friends and colleagues? Use rating scale 0 to 10, where 0 means that you would not recommend it at all while 10 means you would definitely recommend it to your friends/colleagues.?","Group_To what extent would you recommend Home Credit to your friends and colleagues? Use rating scale 0 to 10, where 0 means that you would not recommend it at all while 10 means you would definitely recommend it to your friends/colleagues.?","Positive reasons
Why did you give a rating of {To what extent would you recommend Home Credit to your friends and colleagues? Use rating scale 0 to 10, where 0 means that you would not recommend it at all while 10 means you would definitely recommend it to your friends/colleagues.?}",Other Choice-,Other Choice-,Other Choice-Others,"Neutral Reasons
Why did you give a rating of {To what extent would you recommend Home Credit to your friends and colleagues? Use rating scale 0 to 10, where 0 means that you would not recommend it at all while 10 means you would definitely recommend it to your friends/colleagues.?}",Other Choice-,Other Choice-Others,"Negative Reasons
Why did you give a rating of {To what extent would you recommend Home Credit to your friends and colleagues? Use rating scale 0 to 10, where 0 means that you would not recommend it at all while 10 means you would definitely recommend it to your friends/colleagues.?}",Other Choice-,Other Choice-Others,Have you had any positive experience in using Home Credit services during the last year?,What specifically pleased you?,Have you had any Negative experience in using Home Credit services during the last year?,What problem(s) was it? Why were you not satisfied?,Please share your suggestions on how Home Credit can improve its products and services.
10,JALDIE LOAN MIL GYA,10,Promoters,Quick loan approvals / Higher chances of loan getting approved,,,,No neutral reason,,,No negative reason,,,Yes,JALDIE LOAN MIL GYA,No,,CUSTOBER CARE ME CALL JALDIE CONNNECT HONIE CHYIE
5,rate of interest is too high,8,Passive,No positive reason,,,,No neutral reason,,,High interest rate,,,Yes,quick loan approval as you can get instant loan in home credit,No,,interest rate should be reduced
10,jarurat ke time par loan mil jata,10,Promoters,I received the loan from HC when I was in need,,,,No neutral reason,,,No negative reason,,,Yes,jarurat ke time par loan mil jata,No,,no suggestion
5,rate of interest is too high,2,Detractor,No positive reason,,,,No neutral reason,,,"High interest rate|Expensive fees & Charges - Penalty charges, Bounce charges, late payment charges",,,Yes,get loan when they need,No,,rate of interest should be reduced
9,fast process hai customer care service is also good,9,Promoters,Overall satisfaction – Everything was ok/without problems,,,,No neutral reason,,,No negative reason,,,Yes,zada call karke preshan nhi kiya jata ye khas laga,No,,no suggestion
9,"easy application process , you will get loan very easily",10,Promoters,I received the loan from HC when I was in need,,,,No neutral reason,,,No negative reason,,,Yes,less documentation is the best  in home credit,No,,no suggestion
9,"Home Credit service is good, offers keep coming but offer was not selected.",10,Promoters,"Application Process - Easy, Fast and Convenient|Less Documents required for taking a loan / convenient loan application process",,,,No neutral reason,,,No negative reason,,,Yes,Home Credit's service is best,No,,no suggestion
9,fast process hai,10,Promoters,"Less Documents required for taking a loan / convenient loan application process|I trust HC / I know this company|Application Process - Easy, Fast and Convenient",,,,No neutral reason,,,No negative reason,,,Yes,fast application process,No,,interest rate jada hai kam hona chahiye
9,"quick loan approval , you will get instant loan",8,Passive,No positive reason,,,,Will recommend but am not sure whether they will take it or not,,,No negative reason,,,Yes,quick loan approval and less documnetation,No,,no suggestion
9,"Personal Loan Service achhi laggi aur Home Credit ki fast Service hai, Jaldi Loan mill jata hai.",10,Promoters,"Quick loan approvals / Higher chances of loan getting approved|Application Process - Easy, Fast and Convenient",,,,No neutral reason,,,No negative reason,,,No,,No,,No Suggestion
9,JALDIE LOAN MIL GYA,10,Promoters,Already recommended to my friends,,,,No neutral reason,,,No negative reason,,,Yes,JALDIE LOAN MIL GYA,No,,CUSTOBER KE LIYE INTEREST THODA KAM KIYA JAYE
9,Home Credit Team does not take much time to give loan to the customer,10,Promoters,Already recommended to my friends|I received the loan from HC when I was in need|Quick loan approvals / Higher chances of loan getting approved,,,,No neutral reason,,,No negative reason,,,Yes,"I tried many apps and was not able to get a loan, so I tried Home Credit and got the loan immediately.",No,,no suggestion
9,You get money on time through home credit,10,Promoters,I received the loan from HC when I was in need,,,,No neutral reason,,,No negative reason,,,Yes,Loan can be availed on time and larger amount can also be availed.,No,,interest rate is very high
9,loan time se mill gaya,10,Promoters,Customer care service is good,,,,"Yes, I will recommend the brand to people I know",,,No negative reason,,,Yes,time par loan mill gaya,No,,no suggestion
5,Home Credit ka Interest Rate bhut jayda hai bakiyo ke mukewale.,3,Detractor,No positive reason,,,,No neutral reason,,,High interest rate,,,Yes,jaldi Loan mill gya tha Home Credit se.,No,,Interest Rate thoda sa kam hona chahiye aur Customer Care par call jaldi se connect hona chahiye.
9,"quick loan approval , fast service",10,Promoters,Quick loan approvals / Higher chances of loan getting approved|Less Documents required for taking a loan / convenient loan application process|I received the loan from HC when I was in need,,,,No neutral reason,,,No negative reason,,,Yes,loan service in home credit is good,No,,no suggestion
9,JALDIE LOAN MIL GYA,10,Promoters,Quick loan approvals / Higher chances of loan getting approved,,,,No neutral reason,,,No negative reason,,,Yes,JALDIE LOAN MIL GYA,No,,कोई कारण नहीं
10,customer service ache hai,9,Promoters,"Application Process - Easy, Fast and Convenient",,,,No neutral reason,,,No negative reason,,,Yes,application process asan hai,No,,no suggestion
10,time period of loan amount is good in home credit,10,Promoters,"Affordable Product & Services - Price, fees and terms",,,,No neutral reason,,,No negative reason,,,Yes,"time period of loan is best in home credit , as u can manage it by on your choice",Yes,"customer don't know about auto debit payment system , so he paid in advance for EMI pending , that cause the double amount deduct from his account by itself on due date AND they request for refund , there is no refund till now",no suggestion
9,Home Credit me Loan Approval bhut jaldi aa gya tha.,10,Promoters,Quick loan approvals / Higher chances of loan getting approved|I received the loan from HC when I was in need,,,,No neutral reason,,,No negative reason,,,Yes,Minimum Documents me bhut jaldi Approval aa gya tha.,No,,Customer Care Service thoda aur acha hona chahiye.
10,"FAST PROCESS HAI , AUR KAHI SE LOAN NHI MILA HOME CREDIT NE LOAN DIYA",10,Promoters,"Already recommended to my friends|Application Process - Easy, Fast and Convenient|I received the loan from HC when I was in need",,,,No neutral reason,,,No negative reason,,,Yes,EMI KE REGARDING JADA CALL NHI AATI,No,,NO SUGGESTION
10,"There is no time taken in giving home credit loan, the loan is available immediately.",10,Promoters,I received the loan from HC when I was in need,,,,No neutral reason,,,No negative reason,,,Yes,Loved that Home Credit gives loan in short time,No,,no suggestion
4,Interest Rate bhut jyada hai aur annual charge bhi laga diya gya Home Credit ki taraf se.,7,Passive,No positive reason,,,,Others,,Jisko bhut jaruri hai Keval wahi Loan le.,"High interest rate|Expensive fees & Charges - Penalty charges, Bounce charges, late payment charges",,,No,,No,,Interest Rate thoda sa kam hona chahiye.
10,get loan when they need,10,Promoters,Already recommended to my friends,,,,No neutral reason,,,No negative reason,,,Yes,"less documentation , you don't need to go go anywhere and there",No,,no suggestion
8,negative :  More calls and messages are coming,8,Passive,Quick loan approvals / Higher chances of loan getting approved,,,,No neutral reason,,,No negative reason,,,Yes,Getting a loan when I need it,No,,No suggestions
6,Customer's extra charge is being deducted,8,Passive,"Quick loan approvals / Higher chances of loan getting approved|Application Process - Easy, Fast and Convenient",,,,No neutral reason,,,No negative reason,,,Yes,Loan gets approved quickly,No,,The customer needs information about additional charges being deducted from the account.
10,call reminder service is very good in home credit,10,Promoters,"Quick loan approvals / Higher chances of loan getting approved|Application Process - Easy, Fast and Convenient",,,,No neutral reason,,,No negative reason,,,Yes,"less documentation , you don't need to go anywhere",No,,no suggestion
10,"service , fast loan get",8,Passive,"Overall satisfaction – Everything was ok/without problems|Customer care service is good|Application Process - Easy, Fast and Convenient",,,,No neutral reason,,,"Expensive fees & Charges - Penalty charges, Bounce charges, late payment charges",,,Yes,agriculture used,No,,no
10,quick loan approval and payment process is easy,10,Promoters,I received the loan from HC when I was in need,,,,No neutral reason,,,No negative reason,,,Yes,provide emergency \ instant loan service,No,,no suggestion
10,FAST PROCESS HAI,10,Promoters,"Application Process - Easy, Fast and Convenient",,,,No neutral reason,,,No negative reason,,,No,,No,,NO SUGGESTION
8,Do you have to pay extra money to repay the home credit loan.,10,Promoters,Overall satisfaction – Everything was ok/without problems,,,,No neutral reason,,,No negative reason,,,Yes,I got the loan easily.,Yes,"Even after repaying the flexible loan, more extra money has to be paid.",No Suggestion
9,customer ko jaldi loan mill gaya,7,Passive,No positive reason,,,,Will recommend but am not sure whether they will take it or not,,,No negative reason,,,Yes,over all service ache lagi customer ko,No,,customer service fast honi chahiye
10,turant loan ho jata hai,9,Promoters,Overall satisfaction – Everything was ok/without problems,,,,No neutral reason,,,No negative reason,,,No,,No,,repayment option jaldi hona chaiye
8,Calls start coming 10 days before the due date and the customer becomes very irritated.,5,Detractor,No positive reason,,,,No neutral reason,,,High interest rate,,,Yes,The loan process was done immediately,Yes,Calls start coming 10 days before the due date and the customer becomes very irritated.,interest rate should be less
10,"interest low , fast",8,Passive,"Overall satisfaction – Everything was ok/without problems|Application Process - Easy, Fast and Convenient|Customer care service is good",,,,No neutral reason,,,No negative reason,,,Yes,business,No,,no
9,The collection process is quite easy and the application process is also quite easy,10,Promoters,"Less Documents required for taking a loan / convenient loan application process|Application Process - Easy, Fast and Convenient",,,,No neutral reason,,,No negative reason,,,Yes,"Home Credit's service is the best, work becomes easy in Home Credit and there is safety too.",No,,"Even after paying EMI, calls are very high"
9,"The loan comes quickly, overall that's good for me",8,Passive,Overall satisfaction – Everything was ok/without problems,,,,No neutral reason,,,No negative reason,,,Yes,overall  good,No,,No Suggestions
1,"Loans that appear eligible are not available.
Home grade system is not good.",0,Detractor,No positive reason,,,,No neutral reason,,,Bad service quality / Problems with service/Bad experience,,,Yes,"It was better to get a mobile phone through a loan.
Personal loan is absolutely useless.",No,,The rate of interest should be lower.
9,Jarurat ke time par Loan mill gaya tha aur Home Credit ki Sabhi Service achhi laggi.,10,Promoters,Overall satisfaction – Everything was ok/without problems|Quick loan approvals / Higher chances of loan getting approved,,,,No neutral reason,,,No negative reason,,,No,,No,,No Suggestion
9,JARURAT KE TIME PAR LOAN MIL JATA,10,Promoters,"I received the loan from HC when I was in need|Application Process - Easy, Fast and Convenient",,,,No neutral reason,,,No negative reason,,,No,,No,,NO SUGGESTION
10,need ke according loan mil gaya.,10,Promoters,I received the loan from HC when I was in need,,,,No neutral reason,,,No negative reason,,,Yes,time per approval mil jata hai.,No,,no suggestion .
7,Home Credit ki taraf se bhut jyada Interest rate lagaya jata hai.,7,Passive,Overall satisfaction – Everything was ok/without problems|I received the loan from HC when I was in need|Others,,,Laon force close karne ki Facility hoti hai Home Credit me.,No neutral reason,,,No negative reason,,,No,,No,,Interest Rate thoda sa kam hona chahiye aur Customer Care par call jaldi connect hona chahiye.
10,over all service ache lage,10,Promoters,"Application Process - Easy, Fast and Convenient",,,,No neutral reason,,,No negative reason,,,Yes,over all sab acha laga,No,,no suggestion
10,Executive provide information very nicely to customer,10,Promoters,"Affordable Product & Services - Price, fees and terms|Quick loan approvals / Higher chances of loan getting approved",,,,No neutral reason,,,No negative reason,,,Yes,quick loan approval and get loan when they need,No,,no suggestion
10,home credit is good brand,8,Passive,Overall satisfaction – Everything was ok/without problems,,,,Score 10 is too high for evaluation.,,,"Expensive fees & Charges - Penalty charges, Bounce charges, late payment charges",,,Yes,customer care support is good services,No,,Application Process Easy Fast
8,Interest rate is very high please increase low that's better,10,Promoters,Overall satisfaction – Everything was ok/without problems,,,,No neutral reason,,,No negative reason,,,Yes,Fastly got it loan in home credit,No,,satisfied loan in home credit
9,instant approval instant disbursement,10,Promoters,Already recommended to my friends,,,,No neutral reason,,,No negative reason,,,Yes,Reminder call comes before installment,No,,no suggestion
9,TIME PER LOAN MIL JATA HAI.,7,Passive,No positive reason,,,,Will recommend but am not sure whether they will take it or not,,,High interest rate,,,Yes,TIME PER LOAN MIL JATA HAI .,Yes,emi late  bharne ke liye time diya jaay.,emi late  bharne ke liye time diya jaay.
9,Customer care service is good,9,Promoters,Overall satisfaction – Everything was ok/without problems|Customer care service is good,,,,No neutral reason,,,No negative reason,,,Yes,approve loan got it fastly,No,,Interest rate is very high please increase low
8,INTEREST RATE JADA HAI,7,Passive,I received the loan from HC when I was in need,,,,No neutral reason,,,High interest rate,,,Yes,आसान repayment और collection process,No,,NO SUGGESTION
9,Quick loan approvals  ....service good,10,Promoters,Overall satisfaction – Everything was ok/without problems,,,,Will recommend but am not sure whether they will take it or not,,,No negative reason,,,No,,No,,No suggestions
7,CALLS AATE HAI BHOT JADA LOAN KE LIY,8,Passive,"Already recommended to my friends|I received the loan from HC when I was in need|Application Process - Easy, Fast and Convenient",,,,No neutral reason,,,No negative reason,,,Yes,FAST APPLICATION PROCESS,No,,ZADA CALLS AATE HAI NHI AANE CHAHIYE
9,jaldi loan mil jada hai,9,Promoters,"Application Process - Easy, Fast and Convenient|Quick loan approvals / Higher chances of loan getting approved",,,,No neutral reason,,,No negative reason,,,No,,No,,no suggestion
9,personal loan service and quick loan approval,10,Promoters,"Application Process - Easy, Fast and Convenient|Quick loan approvals / Higher chances of loan getting approved",,,,No neutral reason,,,No negative reason,,,Yes,"quick loan approval and everything arranged online , so you don't need to go anywhere",No,,no suggestion
8,Interest rate is very high increase low and publicity on board,10,Promoters,Overall satisfaction – Everything was ok/without problems|Customer care service is good,,,,No neutral reason,,,No negative reason,,,Yes,Nothing else,No,,interest rate is high please increase low
9,"JARURAT KE TIME PAR LOAN MIL JATA , ONLINE PROCESS HAI ACHA LAGA , FAST PROCESS",10,Promoters,"I received the loan from HC when I was in need|Affordable Product & Services - Price, fees and terms",,,,No neutral reason,,,No negative reason,,,No,,No,,NO SUGGESTION
9,easy loan ho jata hai hai,10,Promoters,"Application Process - Easy, Fast and Convenient|Less Documents required for taking a loan / convenient loan application process",,,,No neutral reason,,,No negative reason,,,No,,No,,no suggestion
9,JALDIE LOAN MIL GYA,8,Passive,Quick loan approvals / Higher chances of loan getting approved,,,,No neutral reason,,,No negative reason,,,Yes,JALDIE LOAN MIL GYA,No,,CUSTOBER CARE KI TARAF SE CUSTOBER KI PURE SAYTA KI JAYE UNKI PROBLAM KA SALUTCION JALDIE KIYA JANA CHYIE
8,everything is good= interest rate jayda hai.,8,Passive,I received the loan from HC when I was in need,,,,No neutral reason,,,No negative reason,,,Yes,time per loan mil jata hai.,No,,interest rate kam kiya jaay.
9,Quick loan approvals,10,Promoters,Quick loan approvals / Higher chances of loan getting approved,,,,No neutral reason,,,No negative reason,,,No,,No,,It would be better to give two more days apart from the day of EMI payment
7,Abhi jyada time nhi hua hai isliye mai itna hi rating de skta hu abhi baaki Home Credit me sab kuch acha hai. Time-To-Time EMI Bank se Cut ho raha hai ye acha laga.,7,Passive,No positive reason,,,,Don’t have much experience to recommend / Too early to comment.,,,No negative reason,,,Yes,Jaldi se Approval aa gya tha aur jarurat ke time par mill gya tha Loan,No,,No Suggestion
9,approval jaldi aata hai,9,Promoters,Overall satisfaction – Everything was ok/without problems,,,,No neutral reason,,,No negative reason,,,No,,No,,no suggestion
10,JALDIE LOAN MIL GYA,10,Promoters,Quick loan approvals / Higher chances of loan getting approved,,,,No neutral reason,,,No negative reason,,,Yes,JALDIE LOAN MIL GYA,No,,कोई कारण नहीं
10,JALDIE LOAN MIL GYA,10,Promoters,Quick loan approvals / Higher chances of loan getting approved,,,,No neutral reason,,,No negative reason,,,Yes,JALDIE LOAN MIL GYA,No,,CUSTOBER KE LIYE INTEREST THODA KAM KIYA JAYE
10,Loan is available immediately when needed,7,Passive,No positive reason,,,,No neutral reason,,,High interest rate,,,Yes,I applied for the loan and got the loan immediately and that's when I needed it.,Yes,Customer care is not good at all,Customer support should be good
10,Everything is good,10,Promoters,Quick loan approvals / Higher chances of loan getting approved|Overall satisfaction – Everything was ok/without problems,,,,"Yes, I will recommend the brand to people I know",,,No negative reason,,,Yes,They gave me a loan when I needed it,No,,No Suggestions
7,interest rat jada hai,8,Passive,Customer care service is good,,,,"Yes, I will recommend the brand to people I know",,,High interest rate,,,Yes,interest rat kam hona chahiye,No,,interest rat kam hona chahiye ur sab acha hai
10,"Customer required a loan, he got the loan easily.",10,Promoters,"Application Process - Easy, Fast and Convenient",,,,No neutral reason,,,No negative reason,,,Yes,Loan was easily availed from Home Credit and reminder of due date also comes.,No,,no suggestion
9,online saree process ho jaate hain ye acha laga,10,Promoters,Overall satisfaction – Everything was ok/without problems,,,,No neutral reason,,,No negative reason,,,Yes,online saree process ho jaate hain ye acha laga,No,,no suggestion
9,OVERALL SERVICE IS GOOD.,10,Promoters,Overall satisfaction – Everything was ok/without problems,,,,No neutral reason,,,No negative reason,,,Yes,JALDI APPROVAL MIL JATA HAI.,No,,NO SUGGESTION.
10,process good,7,Passive,No positive reason,,,,No neutral reason,,,High interest rate,,,No,,No,,no suggestion
5,interest rate bhut jyada h,8,Passive,Quick loan approvals / Higher chances of loan getting approved,,,,No neutral reason,,,No negative reason,,,Yes,apply kartehi  jaldi ho jata hai kaam,No,,interest ret ko kam kiya jaye jisse ki hum koi customer late to who le le
10,documents kam lagte hai,8,Passive,"Application Process - Easy, Fast and Convenient",,,,No neutral reason,,,No negative reason,,,Yes,jarurat ke time par loan mil gaya,No,,no suggestion
8,INTEREST RATE KAM HONA CHIYE,5,Detractor,No positive reason,,,,No neutral reason,,,High interest rate|Others,,CUSTOMER LOAN KI HALF PAYMENT PAY KARNY K BAD  HALF PAYMENT PER EMI DENA CHATA H BUT HOME CREDIT KI SIDE SY REJECT KAR DIYA GYA,Yes,JARURAT K TIME LOAN  APPROVED HO GYA,No,,INTEREST RATE KAM KARNA CHIYE
7,"The customer had paid his EMI a day before but still the penalty was charged.
the customer should be given complete information regarding EMI.",8,Passive,No positive reason,,,,No neutral reason,,,High interest rate,,,No,,Yes,"The customer had paid his EMI a day before but still the penalty was charged.
the customer should be given complete information regarding EMI.",No charge should be deducted from the customer who is paying EMI before time.
9,JALDIE LOAN MIL GYA,10,Promoters,Quick loan approvals / Higher chances of loan getting approved,,,,No neutral reason,,,No negative reason,,,Yes,JALDIE LOAN MIL GYA,No,,CUSTOBER KE LIYE INTEREST THODA KAM KIYA JAYE
7,"customer care not connected , time waste",7,Passive,Overall satisfaction – Everything was ok/without problems,,,,No neutral reason,,,Bad service quality / Problems with service/Bad experience,,,No,,No,,improve customer care connectivity
8,Call to Telugu customer care not connecting quickly,10,Promoters,Quick loan approvals / Higher chances of loan getting approved|Overall satisfaction – Everything was ok/without problems|I received the loan from HC when I was in need,,,,"Yes, I will recommend the brand to people I know",,,No negative reason,,,Yes,I cleared the flexible loan in a month and was not charged any interest,No,,No Suggestions
9,fast process hai jaldi loan mil gya,10,Promoters,I received the loan from HC when I was in need,,,,No neutral reason,,,No negative reason,,,Yes,easy process kam documents lagte,No,,no suggestion
9,"easy process ,online facility is good.",9,Promoters,I received the loan from HC when I was in need|Quick loan approvals / Higher chances of loan getting approved,,,,No neutral reason,,,No negative reason,,,Yes,"time per loan mil jata hai, easy process .",No,,no suggestion.
9,JALDIE LOAN MIL GYA,10,Promoters,Quick loan approvals / Higher chances of loan getting approved,,,,No neutral reason,,,No negative reason,,,Yes,JALDIE LOAN MIL GYA,No,,कोई कारण नहीं
5,customer care me call nahi lagati,2,Detractor,No positive reason,,,,No neutral reason,,,High interest rate|Bad service quality / Problems with service/Bad experience,,,No,,No,,customer ko achi service mill nii chahiye
10,loan process jaldi ho jata h,10,Promoters,"Quick loan approvals / Higher chances of loan getting approved|Application Process - Easy, Fast and Convenient",,,,No neutral reason,,,No negative reason,,,No,,No,,ek sath loan bharne ka option di jaiye
10,"positive : easy process hai , negetive : interest  rate jada hai",10,Promoters,"Application Process - Easy, Fast and Convenient|Already recommended to my friends",,,,No neutral reason,,,No negative reason,,,No,,No,,no suggestion
8,"I paid the last Flexible loan EMI and closed it, but again I got a message asking me to pay 1800...... If you call customer care they are not responding properly ..It would be good to have an office related to home credit in Vijayawada.....",8,Passive,Overall satisfaction – Everything was ok/without problems,,,,No neutral reason,,,No negative reason,,,No,,Yes,"I paid the last Flexible loan EMI and closed it, but again I got a message asking me to pay 1800......High interest rate",.It would be good to have an office related to home credit in Vijayawada.....
10,ONLINE SERVICE ACHI LAGI,10,Promoters,Already recommended to my friends|I received the loan from HC when I was in need,,,,No neutral reason,,,No negative reason,,,Yes,JARURAT K TIME LOAN MILL GYA,No,,NO SUGGESTION
7,"due date change , exiting customer no offer",9,Promoters,"Application Process - Easy, Fast and Convenient|Customer care service is good|Overall satisfaction – Everything was ok/without problems",,,,No neutral reason,,,No negative reason,,,Yes,personal use,No,,"due date ,"
10,I like the flexible loan the most.,10,Promoters,Overall satisfaction – Everything was ok/without problems,,,,No neutral reason,,,No negative reason,,,No,,No,,no suggestion
10,loan approval fast hain,10,Promoters,"Application Process - Easy, Fast and Convenient",,,,No neutral reason,,,No negative reason,,,Yes,customer's ko jarurat time par loan mil jata hain,No,,no suggestion
1,interest rat jada hai,0,Detractor,No positive reason,,,,No neutral reason,,,High interest rate,,,No,,No,,interest rat kam hona chahiye
9,loan approval fast hain,10,Promoters,Overall satisfaction – Everything was ok/without problems,,,,No neutral reason,,,No negative reason,,,Yes,"interest rate accha hain, loan approval fast hain, and documents kam lagte hain",No,,no suggestion
