8,Customer care service is good,10,Promoters,Customer care service is good,,,,Don’t have much experience to recommend / Too early to comment.,,,"Lack of information provided – about terms / procedures|Expensive fees & Charges - Penalty charges, Bounce charges, late payment charges",,,Yes,Application Process Easy Fast,No,,intersted rate is very high
8,home credit ki app chalane mein kafi dikkat aati hai  app open nhi hoti,7,Passive,No positive reason,,,,Others|No specific reason mentioned by the customer.,,home credit finance not easily available,No negative reason,,,Yes,Loan gets approved instantly over the phone,No,,no suggestion
8,High interest rate,8,Passive,"Quick loan approvals / Higher chances of loan getting approved|Application Process - Easy, Fast and Convenient",,,,No neutral reason,,,No negative reason,,,Yes,Overall satisfaction,No,,High interest rate
10,KAM SAMEYA ME JALDIE LOAN MIL GYA,10,Promoters,Quick loan approvals / Higher chances of loan getting approved,,,,No neutral reason,,,No negative reason,,,Yes,JALDIE LOAN MIL GYA,No,,कोई कारण नहीं
9,time pr loan mil jata h,8,Passive,No positive reason,,,,"Yes, I will recommend the brand to people I know",,,No negative reason,,,Yes,khas pasand y aaya ki jo ishq application hai woh ghar baithe hum online kar sakte hain,No,,hum jab personal loan lete hain tab usmen offer rehta hai tbhi milta nahi toh nahi milta hai toh ise sudhar kiya jaye ki bina offer ke hame lpoan mil jaiye
9,EMI PAY KARNE MAI AGAR EK DO DIN LATE HOJATA TOH  PANELTY NHI LAGTI,10,Promoters,Quick loan approvals / Higher chances of loan getting approved,,,,No neutral reason,,,No negative reason,,,Yes,APPROVAL JALDI AATA,No,,NO SUGGESTION
8,"I paid the last EMI and closed it, but again I got a message asking me to pay 1800....Telugu customer care is not available",9,Promoters,I received the loan from HC when I was in need,,,,"Yes, I will recommend the brand to people I know",,,No negative reason,,,Yes,Overall satisfaction,No,,High interest rate
9,jaldi application process pura ho gya,9,Promoters,"Application Process - Easy, Fast and Convenient",,,,No neutral reason,,,No negative reason,,,Yes,jab loan ki jarurat thi tab loan mil gya,Yes,"customer ko proper procedure ke बारे में nhi bataya tha  jab loan ke liye apply kar raha tha tab to bola tha ki agar aap beech mai close karenge to intrested vah tak lagega  
or bad mai loan approve hone ke baad call karke agent ne bolte ki agar aapko loan close karenge to interest pure loan per lagega",apne client ko loan ki puri  detail clear karke batana chahiye
10,JARURAT KE TIME PAR LOAN MIL JATA,10,Promoters,I received the loan from HC when I was in need,,,,No neutral reason,,,No negative reason,,,Yes,"JARURAT KE TIME PAR LOAN MIL JATA , FAST PROCESS",No,,NO SUGGESTION
10,jarurat pr loan mil jata hai or apne time to time kist kat jaati h,10,Promoters,Overall satisfaction – Everything was ok/without problems,,,,No neutral reason,,,No negative reason,,,Yes,stop ke log pasand aur woh times se loan de dete hain aur time se hum jama kar dete hain,No,,staff ke logo ko bahut bahut dhanyavad or time pe help kete h log
1,corrected pay but charged,4,Detractor,"Application Process - Easy, Fast and Convenient",,,,I don’t like to recommend to anyone.,,,"Expensive fees & Charges - Penalty charges, Bounce charges, late payment charges|High interest rate",,,Yes,mobile,No,,correct time pay
8,overall service is good,10,Promoters,Overall satisfaction – Everything was ok/without problems,,,,No neutral reason,,,No negative reason,,,Yes,overall service is good,No,,no suggestion
10,jaldi loan approved ho gya,10,Promoters,Quick loan approvals / Higher chances of loan getting approved|I received the loan from HC when I was in need,,,,No neutral reason,,,No negative reason,,,Yes,laon jaldi approved ho jata h,No,,interest rate kam hona chiye
10,Agar EMI Period hum Lambe time ke liye choose kare to ishme interest bhi utna jyada lagta hai.,9,Promoters,Overall satisfaction – Everything was ok/without problems|Quick loan approvals / Higher chances of loan getting approved,,,,No neutral reason,,,No negative reason,,,No,,No,,Agar EMI Period hum Lambe time ke liye choose kare to ishme interest bhi utna jyada lagta hai ye thoda sa kam hona chahiye aur Customer Care par call jaldi se connect hona chahiye.
10,all over good,10,Promoters,"Application Process - Easy, Fast and Convenient",,,,No neutral reason,,,No negative reason,,,Yes,application process good,No,,no suggestion
10,jada paresan ni karte ache se kam ho jata hai,10,Promoters,I received the loan from HC when I was in need,,,,No neutral reason,,,No negative reason,,,Yes,acha laga sab kuach,No,,home credit me sab ko loan mill na chahiye
10,"service , fast loaning",8,Passive,"Application Process - Easy, Fast and Convenient|Customer care service is good",,,,No neutral reason,,,No negative reason,,,Yes,"education , personal used",No,,interest high
10,home credit ne offer diya hai woh mujhe bahut achchhi lagi,10,Promoters,Already recommended to my friends,,,,No neutral reason,,,No negative reason,,,Yes,time to time kist jama karne ke liye phone kar dete h,No,,no suggestion
1,EMI pay kerne ka baad bhi extra charges lagte hain,0,Detractor,No positive reason,,,,No neutral reason,,,"Expensive fees & Charges - Penalty charges, Bounce charges, late payment charges",,,Yes,loan approval jaldi aa jata hain,Yes,EMI PAY KERNE K BAAD BHI EXTRA CHARGES LAGTE HAIN,CUSTOMERS K EXTRA CHARGES NHI KATNE CHAYIA
9,Home credit system are very good,10,Promoters,Overall satisfaction – Everything was ok/without problems,,,,No neutral reason,,,No negative reason,,,No,,No,,No Suggestion
10,jarurat ke time loan mil jata hai,9,Promoters,No positive reason,,,,Will recommend but am not sure whether they will take it or not,,,No negative reason,,,Yes,jarurat ke time loan mil gyaa,No,,no suggestion
4,is loan giving time every information's give no hide information's/ our information's give but no full information's some information's hiding me,3,Detractor,No positive reason,,,,No neutral reason,,,Lack of information provided – about terms / procedures,,,Yes,immediate situations be credited,No,,improve full details means no hiding loan information's
6,INTEREST RATE JADA HAI KAM HONA CHAHIYE,3,Detractor,No positive reason,,,,I don’t like to recommend to anyone.,,,No negative reason,,,Yes,JARURAT KE TIME PAR EASLY LOAN MIL JATA,No,,"INTEREST RATE JADA HAI , EMI PAYMENT KE REGARDING  CALLS BHOT JADA AATI HAI"
10,jarurat k time loan mill jata h or asani sy mill gya,10,Promoters,Less Documents required for taking a loan / convenient loan application process,,,,No neutral reason,,,No negative reason,,,Yes,online service achi lagi asani sy loan mill gya koi problam nahi hui loan lenay h,No,,no suggestion
10,JALDIE LON MIL JATA HAI,10,Promoters,Quick loan approvals / Higher chances of loan getting approved,,,,No neutral reason,,,No negative reason,,,Yes,JALDIE LON MIL GYA,Yes,BANK ME BALANCE HONE KE BAD BHI KABHI KABHI EMI NAHI KATIE JATIE HAI MAYRI,AGAR ACOUNT ME BALANCE RAHTA HAI TO EMI BANK SE  HI KAT LAYNIE CHYIE
2,loan ki kist next mount m bharna chara hai customer,0,Detractor,No positive reason,,,,No neutral reason,,,"Expensive fees & Charges - Penalty charges, Bounce charges, late payment charges",,,No,,No,,no suggestion
10,enakk sonna timek loan kudthan,8,Passive,"Affordable Product & Services - Price, fees and terms",,,,"Yes, I will recommend the brand to people I know",,,Lack of information provided – about terms / procedures,,,Yes,i need loan that time i got a loan form home credit,No,,customer have no suggestions
10,EASY REPAYMENT AND COLLECTION PROCESS,8,Passive,Convenient repayment process / collection,,,,No neutral reason,,,No negative reason,,,Yes,WITHOUT GAURRANTY KE AMOUNT DE DIYA JATA HAI,No,,NO SUGGESTION
9,Home Credit से ज़रूरत के समय लोन मिल गया,10,Promoters,Quick loan approvals / Higher chances of loan getting approved|I received the loan from HC when I was in need,,,,No neutral reason,,,No negative reason,,,Yes,jarurat ke समय par home credit se loan le liya tha,Yes,"अगर customer ने home credit से loan already ले रखा है तो कस्टमर का अगर need हो पैसे की तो customer को थोड़ा बहुत लोन नहीं मिल पाया 
topup loan होना चाहिए",अगर customer ने home credit से loan already ले रखा है तो कस्टमर को अगर need हो पैसे की तो customer को थोड़ा बहुत लोन मिलना चाहिए
8,Customer care number not connecting,10,Promoters,Overall satisfaction – Everything was ok/without problems|Quick loan approvals / Higher chances of loan getting approved,,,,No neutral reason,,,No negative reason,,,No,,No,,Customer care number not connecting
8,overall service is good,9,Promoters,Overall satisfaction – Everything was ok/without problems,,,,No neutral reason,,,No negative reason,,,Yes,document kam lagte hain and online process bhi accha hain,No,,no suggestion
10,jarurat ke time loan mil gyaa,10,Promoters,I received the loan from HC when I was in need,,,,No neutral reason,,,No negative reason,,,Yes,jarurat ke time loan mil gyaa,No,,no suggestion
2,Customer apne Loan ke baare me kuch jaankari lena chahta hai lekin unka call Customer Care par connect hi nhi ho raha hai jiski wajah se Customer bhut paresaan hai.,5,Detractor,No positive reason,,,,Will recommend but am not sure whether they will take it or not,,,"Others|Expensive fees & Charges - Penalty charges, Bounce charges, late payment charges|High interest rate",,Customer care par call Connect nhi hota hai jaldi.,Yes,Home Credit me pehle ka anubhav bahut acha tha.,Yes,Customer apne Loan ke baare me kuch jaankari lena chahta hai lekin unka call Customer Care par connect hi nhi ho raha hai.,Customer Care par call jaldi connect hona chahiye Customers ka aur Interest Rate thoda sa aur kam hona chahiye.
10,JALDI LOAN APPROVED HO JATA H AND ACCOUNT SY ASANI SY  KATT JATA H,10,Promoters,I received the loan from HC when I was in need|Quick loan approvals / Higher chances of loan getting approved,,,,No neutral reason,,,No negative reason,,,Yes,JARURAT K TIME PER ASANI SY LOAN MILL JATA H ///// NAGETIVE INTREST RATE  JYADA LAG RAHA H,No,,INTREST RATE KAM HONA CHIYE JISAY  JYADA SY JYADA CUSTOMER CONNACT HO PAYE
10,immediate situations will credit,10,Promoters,"Overall satisfaction – Everything was ok/without problems|Application Process - Easy, Fast and Convenient|Easily available in shops / Dealer recommendation|Affordable Product & Services - Price, fees and terms",,,,No neutral reason,,,No negative reason,,,Yes,immediate and sudden received in money from home credit,No,,customer care service please improve
9,loans are easily available.,10,Promoters,Already recommended to my friends,,,,No neutral reason,,,No negative reason,,,No,,No,,No Suggestion
10,service achi h or loan mil gya turant or phone liya,10,Promoters,Overall satisfaction – Everything was ok/without problems,,,,No neutral reason,,,No negative reason,,,Yes,customer service acha h,No,,no suggestion
10,"JALDIE LON MIL JATA HAI, DIRECT PAYMENT ACOUNT ME AA JATIE HAI",10,Promoters,Less Documents required for taking a loan / convenient loan application process,,,,No neutral reason,,,No negative reason,,,Yes,JARURAT KE SAMEYA LON MIL JATA HAI,No,,कोई कारण नहीं
10,loan time se mil jata hai/ offer b aate rehte hai,10,Promoters,Already recommended to my friends,,,,Will recommend but am not sure whether they will take it or not,,,No negative reason,,,Yes,all good,No,,no suggestion
9,Home credit everything  is very good,10,Promoters,Overall satisfaction – Everything was ok/without problems,,,,No neutral reason,,,No negative reason,,,No,,No,,no suggestion
8,High interest rate ... Home Credit App should be updated,10,Promoters,Quick loan approvals / Higher chances of loan getting approved|Overall satisfaction – Everything was ok/without problems,,,,"Yes, I will recommend the brand to people I know",,,No negative reason,,,Yes,The loan process is fast ... customer care support good,No,,High interest rate .... Home Credit App should be updated
10,overall service is good,10,Promoters,Overall satisfaction – Everything was ok/without problems,,,,No neutral reason,,,No negative reason,,,Yes,overall service is good,No,,customers ko  offer and discount provide kerna chayia
9,home credit customer ko pareshan nhi karta,9,Promoters,No positive reason,,,,"Yes, I will recommend the brand to people I know",,,No negative reason,,,Yes,home credit se mobile finance karvana accha laga,No,,no suggestion
8,sab acha koi problem ni hai,5,Detractor,Customer care service is good,,,,I don’t like to recommend to anyone.,,,No negative reason,,,No,,No,,no suggestion
10,JALDI LOAN APPROVED HO GYA,10,Promoters,Overall satisfaction – Everything was ok/without problems|I trust HC / I know this company,,,,Will recommend but am not sure whether they will take it or not,,,No negative reason,,,Yes,JALDI LOAN MILL GYA AND CALLS PER HI LOAN MILL JATA H,No,,CUSTOMER CARE SY SPORT NHI HO PATA H
10,JALDIE LOAN MIL GYA,10,Promoters,Already recommended to my friends,,,,No neutral reason,,,No negative reason,,,Yes,JARURAT KE SAMEYA JALDIE LOAN MIL GYA,No,,MAIL KARNA HAR KISE CUSTOBER KO AATA NAHI HAI  DOCUMENT SEND KARNE ME PROBLAM HOTIE HAI
1,interest rate thoda kam hona chayia,0,Detractor,No positive reason,,,,No neutral reason,,,High interest rate,,,No,,No,,interest rate thoda kam hona chayia
10,service achi h or customer care se bat bhi ho jati h,10,Promoters,Overall satisfaction – Everything was ok/without problems,,,,No neutral reason,,,No negative reason,,,Yes,time pr loan mil jata hai,No,,no suggestion
9,"NEGETIVE : INTEREST RATE JADA HAI ,  POSITIVE : ALL OVER GOOD",10,Promoters,"Application Process - Easy, Fast and Convenient",,,,No neutral reason,,,No negative reason,,,Yes,CUSTOMER CARE SERVICE IS GOOD,Yes,INTEREST RATE JADA LAGA,INTEREST RATE KAM HONA CHAHIYE
8,loan approval jaldi nhi aata hain,10,Promoters,Quick loan approvals / Higher chances of loan getting approved,,,,No neutral reason,,,No negative reason,,,Yes,customer care service is good,No,,no suggestion
8,Customer ki taraf se bhut calls aate hai jisse mai bhut paresan hota hu aur Interest Rate bhi bhut jyada hai.,7,Passive,No positive reason,,,,"Yes, I will recommend the brand to people I know",,,High interest rate,,,No,,No,,Interest Rate kam hona chahiye aur Customers ke pass jyada calls nhi aana chahiye kyuki Customers ko paresaani hoti hai. (Customer 2 baar ye Feedback de chuka hai aur abhi tak wahi same Problem aa rhi hai Customer ko)
8,phone calls jada aate hai,10,Promoters,Customer care service is good,,,,No neutral reason,,,No negative reason,,,Yes,interest sahi hai,No,,no suggestion
8,CUSTOBER CARE KI TARAF SE  LOAN KE OFFER KE BARAY ME PURIE JANKARI NAHI DI JATIE,9,Promoters,Quick loan approvals / Higher chances of loan getting approved,,,,No neutral reason,,,No negative reason,,,Yes,JALDIE LOAN MIL GYA,No,,"JIS CUSTOBER KA LOAN CHAL RAHA HAI  ,UN CUSTOBER KO  LOAN KE OFFER KE BARE ME  JANKARI DI JAYE CUSTOBER CARE KI TARAF SE"
9,home creadit se loan lena acha laga persanl  loan bhi mil jata hai acha,7,Passive,"Application Process - Easy, Fast and Convenient",,,,No neutral reason,,,No negative reason,,,No,,No,,no suggestion
10,JARURAT KE TIME PAR LOAN MIL JATA HAI,10,Promoters,"Application Process - Easy, Fast and Convenient",,,,No neutral reason,,,No negative reason,,,Yes,LOW SCORE MAI BHI LOAN MIL JATA,No,,NO SUGGESTION
10,JALDI LOAN APPROVED HO JATA H AND CUSTOMER CARE  BHI SPORTED H  AND CUSTOMER SABHI SUVIDHAO SY HAPPY H,10,Promoters,I received the loan from HC when I was in need|Customer care service is good|Overall satisfaction – Everything was ok/without problems,,,,No neutral reason,,,No negative reason,,,Yes,JARURAT K TIME LOAN MILL JATA H,No,,CUSTOMERS KO CUSTOMER CARE NO. PROVIDE KARNA CHIYE
10,Home Credit me sab kuch acha hai aur Loan aasani se mill jata hai.,10,Promoters,"Overall satisfaction – Everything was ok/without problems|Application Process - Easy, Fast and Convenient",,,,No neutral reason,,,No negative reason,,,No,,No,,No Suggestion
10,servie acha h phone mil gya or loan mil gya yhi acha lga,8,Passive,Already recommended to my friends|Quick loan approvals / Higher chances of loan getting approved,,,,No neutral reason,,,No negative reason,,,Yes,जल्दी approval आता है loan,No,,no suggestion
10,turant loan mil jata hai,10,Promoters,Quick loan approvals / Higher chances of loan getting approved|Overall satisfaction – Everything was ok/without problems,,,,No neutral reason,,,No negative reason,,,Yes,jarurat ke time loan mil gyaa,Yes,5000 rs. extra le liye health insurance ke/ customer care contact nhi ho pata,customer care se contact nhi ho pata
7,INTERET RATE JADA HAI,4,Detractor,No positive reason,,,,I don’t like to recommend to anyone.,,,High interest rate,,,Yes,FAST PROCESS HAI HOME CREDIT KA,No,,INTEREST RATE JADA HAI
8,Home Credit website is not working,7,Passive,Overall satisfaction – Everything was ok/without problems,,,,Will recommend but am not sure whether they will take it or not,,,No negative reason,,,Yes,Quick loan approvals.....Overall satisfaction,Yes,Once I had a doubt while paying EMI no one responded to me,No suggestions
10,customer service acha lagi,10,Promoters,Customer care service is good,,,,No neutral reason,,,No negative reason,,,No,,No,,payment time se honi chahiye
10,KAM SAMEYA ME JALDIE LOAN MIL GYA,10,Promoters,Quick loan approvals / Higher chances of loan getting approved,,,,No neutral reason,,,No negative reason,,,No,,No,,कोई कारण नहीं
8,"Positive: loan approval jaldi aa jata hain 
Negative: interest rate thoda kam hona",8,Passive,No positive reason,,,,Will recommend but am not sure whether they will take it or not,,,No negative reason,,,Yes,customer ko emergency fund diya jata hain and customer care service is also good,No,,no suggestion
10,loan time se mil jata hai,10,Promoters,Overall satisfaction – Everything was ok/without problems,,,,No neutral reason,,,No negative reason,,,Yes,jarurat ke time loan milta hai,No,,interest jada hai
7,service is good and time se emi kat jati hai,8,Passive,Quick loan approvals / Higher chances of loan getting approved,,,,No neutral reason,,,No negative reason,,,Yes,कम documents लगते हैं लोन लेने में,No,,no suggestion
10,online payment ho jati vo ache lagi,9,Promoters,Customer care service is good,,,,Will recommend but am not sure whether they will take it or not,,,No negative reason,,,Yes,online kam ho jata hai or jaldi kaam ho jata hai koi problem ni hai,No,,no suggestion
10,easy process hai home credit ka,10,Promoters,Quick loan approvals / Higher chances of loan getting approved|Less Documents required for taking a loan / convenient loan application process,,,,No neutral reason,,,No negative reason,,,Yes,documents kam lagte hai ye acha laga,No,,limit jada honi chahiye loan ke liy
10,bank se kisat khud  kat jatie hai,10,Promoters,Quick loan approvals / Higher chances of loan getting approved,,,,No neutral reason,,,No negative reason,,,Yes,jaldie loan mil gya,No,,ANOCE CUSTOBER KO JALDIE DI JAYE
10,Customers are satisfied with all the services of Home Credit,10,Promoters,Already recommended to my friends|Overall satisfaction – Everything was ok/without problems,,,,No neutral reason,,,No negative reason,,,Yes,JALDI LOAN APPROVED HO  JATA H,No,,NO SUGGESTION
10,loan approval jaldi aa jata hain,10,Promoters,Customer care service is good,,,,No neutral reason,,,No negative reason,,,Yes,document kam lagte hain,No,,no suggestion
8,EMI time 10th ayite baguntundi,10,Promoters,Overall satisfaction – Everything was ok/without problems,,,,No neutral reason,,,No negative reason,,,Yes,Overall satisfaction,No,,EMI time 10th ayite baguntundi
10,आसान repayment और collection process,10,Promoters,I received the loan from HC when I was in need,,,,No neutral reason,,,No negative reason,,,No,,No,,no suggestion
10,jarurat ke time par loan mil jata,9,Promoters,"Application Process - Easy, Fast and Convenient",,,,No neutral reason,,,No negative reason,,,Yes,jarurat ke time par loan mil jata,Yes,auto debit nhi direct clear ka option nhi,auto debit nhi hai clear opption hona chahiye
10,loan approval jaldi aa jata hain,9,Promoters,No positive reason,,,,No neutral reason,,,High interest rate,,,Yes,loan approval jaldi aa jata hain,No,,interest rate thoda kam hona chayia
10,jaldie  loan mil gya,10,Promoters,"Application Process - Easy, Fast and Convenient",,,,No neutral reason,,,No negative reason,,,No,,No,,लोन की शर्तो और नियमो की पूरी जानकारी provide की jaye customer ko
10,"easily process, good beaver.",10,Promoters,"Application Process - Easy, Fast and Convenient",,,,No neutral reason,,,No negative reason,,,Yes,loans are easily available.,No,,no suggestion
10,EMI pay Timing Good,10,Promoters,Convenient repayment process / collection,,,,Will recommend but am not sure whether they will take it or not,,,No negative reason,,,Yes,Overall satisfaction,No,,No Suggestions
8,last loan m card m issue aaye the woh issue dobara nhi aane chahiye,10,Promoters,"Application Process - Easy, Fast and Convenient",,,,No neutral reason,,,No negative reason,,,Yes,finance process acha laga iska,Yes,"card issue aaye the , emi payment issue bhi aate",no suggestion
10,Home Credit से ज़रूरत के समय लोन मिल गया,10,Promoters,Quick loan approvals / Higher chances of loan getting approved|Less Documents required for taking a loan / convenient loan application process,,,,No neutral reason,,,No negative reason,,,Yes,home credit se customer ko koi unnecessary charge nahi lagti,No,,no suggestion
10,Customer is happy with all the facilities of Home CRADIT,10,Promoters,Overall satisfaction – Everything was ok/without problems,,,,No neutral reason,,,No negative reason,,,Yes,KAHI PER BHI ASANI SY HOME CREDIT KA FINACE MILL JATA H,No,,NO SUGGESTIONS
8,Mujhe Loan ki Jarurt hai lekin mujhe nhi mill raha hai.,10,Promoters,"Overall satisfaction – Everything was ok/without problems|Quick loan approvals / Higher chances of loan getting approved|Application Process - Easy, Fast and Convenient",,,,No neutral reason,,,No negative reason,,,Yes,Jab mujhe Loan ki jarurat thi tab Home Credit ne sath diya tha.,No,,No Suggestion
10,time pr loan mil jata ha or time to time kist kt jata h,10,Promoters,Overall satisfaction – Everything was ok/without problems,,,,No neutral reason,,,No negative reason,,,Yes,time pr loan mil jata h jise  ki apna kam ho jata h,No,,no suggestion
10,all good,10,Promoters,Overall satisfaction – Everything was ok/without problems,,,,No neutral reason,,,No negative reason,,,No,,No,,no suggestion
8,REPETED CUSTOMERS K LIYE  INTREST RATE KAM HONA  CHIYE,10,Promoters,Quick loan approvals / Higher chances of loan getting approved|I received the loan from HC when I was in need,,,,No neutral reason,,,No negative reason,,,No,,Yes,REPETED CUSTOMERS K LIYE INTREST RSTE KAM HONA CHIYE JISY CUSTOMER HOME CREDIT K SATH CONNECTIVITY BNAY RAKHAY,NO SUGGESTION
10,time par loan mil gya aur time to time kist karta rahta h,10,Promoters,Overall satisfaction – Everything was ok/without problems,,,,No neutral reason,,,No negative reason,,,Yes,offer milta rehta hai acha laga,No,,no suggestions
7,customer ki EMI two times pay ho gyi jis se customer ko problem hoti hain,10,Promoters,"Application Process - Easy, Fast and Convenient|Quick loan approvals / Higher chances of loan getting approved",,,,No neutral reason,,,No negative reason,,,Yes,"Positive: approval jaldi aa jata hain 
Negative: interest rate thodaa kam hona chayia",No,,customer care service acchi honi chayia
10,Home Credit से ज़रूरत के समय लोन मिल गया,10,Promoters,Overall satisfaction – Everything was ok/without problems,,,,No neutral reason,,,No negative reason,,,Yes,times loan mil jata hai aur time se kam ho jata hai,No,,no suggestion
10,JARURAT KE TIME LOAN MIL GAYA,9,Promoters,No positive reason,,,,I don’t like to recommend to anyone.,,,No negative reason,,,No,,No,,INTEREST RATE JADA HAI
9,Email ID update cheyali loan pending details show avadam ledhu........Overall satisfaction,8,Passive,Quick loan approvals / Higher chances of loan getting approved,,,,"Yes, I will recommend the brand to people I know",,,No negative reason,,,Yes,Overall satisfaction,No,,no suggestions
10,Jaldi se Loan mill jata hai aur Documents bhi kam lagte hai yaha par. Mere App me New Offers show karte hai lekin jab mai click karta hu uss par to wo open nhi hota hai.,10,Promoters,"Overall satisfaction – Everything was ok/without problems|Application Process - Easy, Fast and Convenient|Less Documents required for taking a loan / convenient loan application process|I received the loan from HC when I was in need",,,,No neutral reason,,,No negative reason,,,No,,Yes,Kabhi kabhi Home Credit ki taraf se 2 Times EMI cut ho jata hai aur firr Refund hone me bhut time lagg jata hai.,Jo Offers mere liye hai kam se kam wo Open to hona chahiye.
10,loan turant mil jata hai,10,Promoters,Overall satisfaction – Everything was ok/without problems,,,,No neutral reason,,,No negative reason,,,Yes,turant loan mil jata hai,No,,no suggestion
5,Home credit loans are high interest.,8,Passive,I received the loan from HC when I was in need,,,,No neutral reason,,,No negative reason,,,Yes,loans are easily available..,No,,no suggestion
