10,Home Credit ki EMI Payment Service achhi hai Bank se bhi Auto-Debit ho jata hai aur khud se bhi pay kar skte hai aur Jaldi Loan milta hai Home Credit me.,10,Promoters,Overall satisfaction – Everything was ok/without problems|Quick loan approvals / Higher chances of loan getting approved,,,,No neutral reason,,,No negative reason,,,No,,No,,"Customer call par call Jaldi connect hona chahiye, aur EMI pay ka call 1-2 dinn pehle aana chahiye na ki jis dinn EMI date hai us dinn."
1,ब्याज ज्यादा लिया जा रहा है,0,Detractor,No positive reason,,,,No neutral reason,,,High interest rate,,,No,,Yes,ब्याज ज्यादा लिया जा रहा है,ब्याज कम किया जाए
8,Loans are easily available.,8,Passive,No positive reason,,,,No neutral reason,,,No negative reason,,,No,,No,,no suggestion
6,interest rate is high,6,Detractor,"Application Process - Easy, Fast and Convenient|Quick loan approvals / Higher chances of loan getting approved",,,,No neutral reason,,,No negative reason,,,Yes,"quick loan approval , less time consuming",No,,interest rate should be reduced
9,SERVICE IS GOOD,10,Promoters,Quick loan approvals / Higher chances of loan getting approved,,,,No neutral reason,,,No negative reason,,,Yes,"Had got mobile finance done, one EMI was late so after that I paid the EMI later and there was no problem in it.",No,,no suggestion
10,"time per approval mil jata hai, but interest rate jayda hai.",10,Promoters,Quick loan approvals / Higher chances of loan getting approved,,,,No neutral reason,,,No negative reason,,,Yes,emi late hone per extra charge nhi  dena padta   hai.,Yes,"INTEREST RATE   JAYDA HAI ,",interest  rate kam kiya jaay.
9,Updates from time to time,9,Promoters,Easily available in shops / Dealer recommendation,,,,No neutral reason,,,No negative reason,,,No,,No,,No Suggestions
10,customer service is good/ jaldi kaam ho jata hai/ fast service,10,Promoters,Quick loan approvals / Higher chances of loan getting approved,,,,Will recommend but am not sure whether they will take it or not,,,No negative reason,,,Yes,rate of interest theek hai / kam jaldi ho jata hai,No,,no suggestion
10,good customer care service time to time information dete hai,10,Promoters,Less Documents required for taking a loan / convenient loan application process|Quick loan approvals / Higher chances of loan getting approved,,,,No neutral reason,,,No negative reason,,,Yes,loan ke ache ache offer dete call karke,No,,loan ke offer aane par sabhi customers ko call karke bataya jaay
10,get loan when customer need,10,Promoters,Customer care service is good|Good previous experience / HC resolved my problem,,,,No neutral reason,,,No negative reason,,,Yes,"everything can be arranged online ,you can't  go anywhere for loan",No,,no suggestion
10,service ache hai kam asani se ho jata hai,10,Promoters,"Application Process - Easy, Fast and Convenient|Customer care service is good",,,,No neutral reason,,,No negative reason,,,Yes,jaldi service mill gayi koi paresani ni hui,No,,no suggestion
10,जल्दी लोन मिल गया,10,Promoters,Less Documents required for taking a loan / convenient loan application process,,,,No neutral reason,,,No negative reason,,,Yes,कम समय में जल्दी लोन मिल गया,No,,no reason
9,Loans are easily available.,10,Promoters,No positive reason,,,,No neutral reason,,,No negative reason,,,No,,No,,no suggestion
6,interest is high,6,Detractor,Quick loan approvals / Higher chances of loan getting approved,,,,No neutral reason,,,No negative reason,,,Yes,The loan was received very quickly and there was no problem.,No,,interest rate is very high
8,customer care solution nhi dete hai properly calls transffer karte hai alg alg persons ko lekin solution nhi dete,9,Promoters,No positive reason,,,,No neutral reason,,,High interest rate,,,Yes,trust krte hai time se phle kam ho jata,No,,inetrest rate jada hai kam hona chahiye
6,high interest rate,3,Detractor,No positive reason,,,,No neutral reason,,,High interest rate,,,Yes,jarurt ke time loan mil gya.,Yes,emi sahi se pay karne ke bad bi mujhe extra pay krna pada.,interest rate kam hona cahiye.
10,customer service is good,10,Promoters,Already recommended to my friends,,,,No neutral reason,,,No negative reason,,,Yes,jarurat ke time apko loan mil gyaa,No,,no suggestion
10,"positive : quick loan approval , negative : customer care service is not good",8,Passive,No positive reason,,,,No neutral reason,,,Bad service quality / Problems with service/Bad experience|Too many calls/SMS bothering customer,,,No,,No,,customer care service should be improved as they can't  resolve the query of customer
9,Home Credit se Loan jaldi se mil jata hai aur Documents bhi bhut kam lagta hai.,10,Promoters,Overall satisfaction – Everything was ok/without problems|Less Documents required for taking a loan / convenient loan application process|Quick loan approvals / Higher chances of loan getting approved,,,,No neutral reason,,,No negative reason,,,No,,No,,Jisko Loan ki jarurat hai usko Loan milna chahiye.
9,jaldi loan mil jata hai / jaldi aproval mil jata hai,10,Promoters,Quick loan approvals / Higher chances of loan getting approved|Overall satisfaction – Everything was ok/without problems,,,,No neutral reason,,,Too many calls/SMS bothering customer,,,Yes,jaldi aproval mil jata hai,No,,no suggestion
10,Get instant loan from Home Credit,10,Promoters,Overall satisfaction – Everything was ok/without problems,,,,No neutral reason,,,No negative reason,,,Yes,"There is no problem with Home Credit, the loan is applied instantly.",No,,Suggestion is that Home Credit's service is very good
10,जल्दी लोन मिल गया,10,Promoters,Less Documents required for taking a loan / convenient loan application process,,,,No neutral reason,,,No negative reason,,,Yes,जरूरत के समय लोन मिल गया था,No,,no reason
10,Customer satisfaction with the help of customer care,10,Promoters,Already recommended to my friends,,,,No neutral reason,,,No negative reason,,,Yes,Customer care service was good,Yes,"If I could not repay the two EMIs during the lockdown, I don't know what interest Home Credit charged on it or penalty, and the loan has not been closed yet.",no suggestion
10,Home Credit se Loan Jaldi Mill jata hai.,10,Promoters,Already recommended to my friends|Quick loan approvals / Higher chances of loan getting approved,,,,No neutral reason,,,No negative reason,,,No,,No,,No Suggestion
5,Home Credit ki service achhi laggi lekin Interest rate bhut jyada hai.,5,Detractor,No positive reason,,,,No neutral reason,,,High interest rate,,,No,,No,,Interest Rate thoda sa kamm hona chahiye.
10,loan facility ache lagi customer ko,8,Passive,Overall satisfaction – Everything was ok/without problems,,,,No neutral reason,,,"Expensive fees & Charges - Penalty charges, Bounce charges, late payment charges|Slow Application process",,,Yes,sab acha hai loan mill jata hai,No,,no suggestion
10,quick loan approval and easy repayment and collection process,10,Promoters,"Application Process - Easy, Fast and Convenient",,,,No neutral reason,,,No negative reason,,,Yes,"quick loan approval , less time consuming",No,,no suggestion
10,TIME PER LOAN MIL JATA HAI.,10,Promoters,I received the loan from HC when I was in need,,,,No neutral reason,,,No negative reason,,,Yes,TIME PER  LOAN MIL JATA HAI.,No,,NO  SUGGESTION.  BUT  INTEREST RATE  JAYDA HAI
6,interest rate jada hai,5,Detractor,No positive reason,,,,"Yes, I will recommend the brand to people I know",,,High interest rate,,,Yes,jaldi loan mil jata hai,No,,interset rate kam hona chahiye
9,"Service is good, if any problem arises then customer care number can be easily contacted.",8,Passive,No positive reason,,,,No specific reason mentioned by the customer.,,,No negative reason,,,Yes,There has been no problem in taking loan from hc,No,,no suggestion
3,loan lene me bhot time lag gyaa,0,Detractor,No positive reason,,,,No neutral reason,,,Problem/Issue not resolved by HC|Bad service quality / Problems with service/Bad experience,,,Yes,customer service achi thi 1st time jab phone finance karwaya tha,Yes,custome service achi nahi / miss behave karte hai,miss communication mis behave na kare
8,Loan Lete time online Application Process thoda hard hai.,7,Passive,No positive reason,,,,I don’t like to recommend to anyone.,,,Slow Application process,,,No,,Yes,Loan se Pehle Customer Care se bhut calls aate hai Home Credit ki taraf se.,Loan Lene se pehle Customer care ke bhut calls aate hai wo kam hona chahiye aur aaj kal Fraud number se calls aate hai isliye Home Credit ke pass koi pehchan honi chahiye jisse customer ko Turant para chal jaaye ki ye call Home Credit ki taraf se hai..
10,Loan is applied quickly in Home Credit,10,Promoters,Quick loan approvals / Higher chances of loan getting approved|Overall satisfaction – Everything was ok/without problems,,,,No neutral reason,,,No negative reason,,,Yes,I financed the phone with home credit and took a loan. I liked it.,No,,no suggestion
10,jarurt ke time se loan mil jata hai.,10,Promoters,I trust HC / I know this company|I received the loan from HC when I was in need,,,,No neutral reason,,,No negative reason,,,Yes,"loan service's is good
customer care service's is good
all service's is good",No,,"no suggestion
everything is good."
10,quick loan approval and less documents required,8,Passive,Good previous experience / HC resolved my problem,,,,No neutral reason,,,High interest rate,,,Yes,"quick loan approval , less time consuming services",No,,interest rate  must be reduced
10,all good,10,Promoters,Overall satisfaction – Everything was ok/without problems,,,,No neutral reason,,,No negative reason,,,Yes,all good,No,,no suggestion
8,"negetive : interest rate jada hai , positive : all over service is good",5,Detractor,No positive reason,,,,Will recommend but am not sure whether they will take it or not,,,High interest rate,,,Yes,approval jaldi aata hai,No,,interest rate kam hona chahiye jada hai
10,"The online process is done with a customer executive, I liked it very much. Loan is available immediately",10,Promoters,Good previous experience / HC resolved my problem|Overall satisfaction – Everything was ok/without problems,,,,No neutral reason,,,No negative reason,,,Yes,"When money is needed, the loan gets approved instantly",No,,"If there is a delay of one or two days in paying the installment, then you can give it a day or two."
10,"time per loan mil jata hai, online facility is  very good .",10,Promoters,"I received the loan from HC when I was in need|Application Process - Easy, Fast and Convenient",,,,No neutral reason,,,No negative reason,,,Yes,"online facility is good , time per approval mil jata hai.",No,,no suggestion.
10,जल्दी लोन मिल गया,10,Promoters,Less Documents required for taking a loan / convenient loan application process,,,,No neutral reason,,,No negative reason,,,Yes,जल्दी लोन मिल गया,No,,अगर कोई कस्टमर दो दिन लेट पेमेंट  पे करता है किस्त की तो कस्टमर से  एक्स्ट्रा चार्ज नहीं लेना चाहिए किस्त का
10,"positive: loan millne ka time acha laga
negative: EMI bharne me late ho jata hai usme koi dikat ni hoti",10,Promoters,I received the loan from HC when I was in need,,,,"Yes, I will recommend the brand to people I know",,,No negative reason,,,Yes,jarurat ke time loan mill jata hai,No,,no suggestion
9,Got a loan with down payment,10,Promoters,Easily available in shops / Dealer recommendation,,,,No neutral reason,,,No negative reason,,,No,,No,,No Suggestions
10,in the begginning we join home credit and had good experience because they provide loan  when in need,10,Promoters,Quick loan approvals / Higher chances of loan getting approved|Less Documents required for taking a loan / convenient loan application process|I trust HC / I know this company,,,,No neutral reason,,,No negative reason,,,Yes,"quick loan approval  , easy application process , everything can be arranged online , you don't need to go anywhere and there",No,,interest rate must be low or reduced
9,This is what I got through the loan.,10,Promoters,No positive reason,,,,No neutral reason,,,No negative reason,,,No,,No,,no suggestion
10,Loan is available as per need through Home Cred,10,Promoters,Overall satisfaction – Everything was ok/without problems,,,,No neutral reason,,,No negative reason,,,Yes,everything is good,No,,no suggestion
10,Home Credit ka EMI Due Date mujhe bhut acha laga.,10,Promoters,Already recommended to my friends,,,,No neutral reason,,,No negative reason,,,No,,No,,interest Rate thoda sa aur kam hona chahiye.
10,"extra charges nhi lagte ,  all over service is  good",10,Promoters,Less Documents required for taking a loan / convenient loan application process,,,,No neutral reason,,,No negative reason,,,Yes,customer care ka  baat karne ka tarika acha laga customer se ache se baat karte or information provide karte,No,,no suggestion
10,"Home Credit's service is good, loan gets approved quickly, not many documents are required.",10,Promoters,Quick loan approvals / Higher chances of loan getting approved,,,,No neutral reason,,,No negative reason,,,Yes,Loan gets approved quickly,No,,"The service is good, but sometimes the balance is not deducted from the account on time, hence we face problems."
9,Overall satisfaction,7,Passive,Easily available in shops / Dealer recommendation,,,,Will recommend but am not sure whether they will take it or not,,,No negative reason,,,No,,No,,No Suggestions
10,"emi process is good, everything is good.",10,Promoters,I received the loan from HC when I was in need|Quick loan approvals / Higher chances of loan getting approved,,,,No neutral reason,,,No negative reason,,,Yes,need ke according time per loan mil jata hai.,No,,no suggestion.
7,Loan is not available at the time of need.,10,Promoters,Good previous experience / HC resolved my problem,,,,No neutral reason,,,No negative reason,,,No,,Yes,Customer care number is not available.,"Whenever the customer dials the toll free number, the call is received as customer care number should be dialed."
10,turant loan mil jata hai,10,Promoters,"Quick loan approvals / Higher chances of loan getting approved|Less Documents required for taking a loan / convenient loan application process|Application Process - Easy, Fast and Convenient",,,,No neutral reason,,,No negative reason,,,Yes,emegency me loan mil jata hai,No,,no suggestion
10,jaldi approval a jata hai,10,Promoters,No positive reason|Quick loan approvals / Higher chances of loan getting approved,,,,Will recommend but am not sure whether they will take it or not,,,No negative reason,,,Yes,sab badiya laga,No,,no suggestion
10,"positive : personal laon acha laga , all over good , negitive : limit kam mili",10,Promoters,"Affordable Product & Services - Price, fees and terms",,,,Will recommend but am not sure whether they will take it or not,,,No negative reason,,,Yes,jarurat ke time par loan mil gya,No,,no suggestion
10,customer care service is good and home credit done what he says,10,Promoters,Less Documents required for taking a loan / convenient loan application process|Quick loan approvals / Higher chances of loan getting approved,,,,No neutral reason,,,No negative reason,,,Yes,easy application process and they do not apply penalty charges immediately,Yes,interest rate  is too high in personal loan,interest rate should be  reduced
10,जरूरत के वक्त कम समय में लोन मिल गया था,10,Promoters,Less Documents required for taking a loan / convenient loan application process,,,,No neutral reason,,,High interest rate,,,Yes,जरूरत के वक्त कम समय में लोन मिल गया था,No,,ब्याज कम होना चाहिए
10,Updates from time to time,10,Promoters,Easily available in shops / Dealer recommendation,,,,Will recommend but am not sure whether they will take it or not,,,No negative reason,,,Yes,Got a loan with down payment,No,,no suggestions
4,The limit mentioned in Home Credit is not available and the charges are very high.,2,Detractor,No positive reason,,,,No neutral reason,,,"Expensive fees & Charges - Penalty charges, Bounce charges, late payment charges",,,No,,Yes,My home credit has been charged several times.,"The suggestion is to reduce the amount of charge, excessive charge is deducted."
9,Loans are easily available.,9,Promoters,HC removed my late payment charges/penalty charges,,,,No neutral reason,,,No negative reason,,,No,,No,,No suggestion
6,interest rate  jayda hai.,5,Detractor,No positive reason,,,,No neutral reason,,,High interest rate,,,Yes,loan ke liye time per approval mil  jata hai.,No,,interest rate kam kiya jaay.
9,Home Credit se Loan Jaldi se milta hai lekin Interest rate thoda jayda hai.,10,Promoters,"Application Process - Easy, Fast and Convenient|Quick loan approvals / Higher chances of loan getting approved",,,,No neutral reason,,,No negative reason,,,No,,No,,Purane Customers ke liye Interest Rate thoda sa kam hona cahiye Home Credit se.
10,online process hai ye acha laga,8,Passive,No positive reason,,,,No neutral reason,,,Problem/Issue not resolved by HC,,,No,,Yes,customer care se baat nhi hoti problem ke time par,customer care se baat nhi ho pati
1,मैं लोन लेना नहीं चाहता था  मेरी बिना मर्जी के ही अकाउंट में ट्रांसफर कर दिया  ज्यादा लोन,0,Detractor,No positive reason,,,,No neutral reason,,,"Expensive fees & Charges - Penalty charges, Bounce charges, late payment charges",,,No,,Yes,मैं लोन लेना नहीं चाहता था  मेरी बिना मर्जी के ही अकाउंट में ट्रांसफर कर दिया  ज्यादा लोन,"कस्टमर को कितने रुपए का लोन चाहिए  ये पहले कस्टमर से पूछना चाहिए , लोन देने से पहले"
10,Felexi aur Personal Loan dono hi bhut acha laga aur aasani se Loan Mill jata hai Home Credit se,10,Promoters,Quick loan approvals / Higher chances of loan getting approved|Overall satisfaction – Everything was ok/without problems|I received the loan from HC when I was in need,,,,No neutral reason,,,No negative reason,,,Yes,Jarurt ke time par Home Credit se Loan mill gya tha.,Yes,Customer care pe Customer ka call jaldi connect hona chahiye.,"Customer Care par call connect nhi hota hai, isliye Customer Care par Call jaldi connect hona chahiye."
10,Home Credit me Application Process bhut aasan aur tez hai aur mujhe Ujjawal EMI Card Banwana chahta hu.,10,Promoters,"Overall satisfaction – Everything was ok/without problems|I received the loan from HC when I was in need|Application Process - Easy, Fast and Convenient|Affordable Product & Services - Price, fees and terms",,,,No neutral reason,,,No negative reason,,,Yes,Home Credit ne Jarurt ke Time par Sath diya tha.,No,,No Suggestion
10,जल्दी लोन मिल गया,10,Promoters,Less Documents required for taking a loan / convenient loan application process,,,,No neutral reason,,,No negative reason,,,Yes,जल्दी लोन मिल गया था,No,,ब्याज कम होना चाहिए
2,"Customer apna Loan Force close karwane ke liye Customer care par baat karne ki bhut kosis kar raha hai lekin uska call connnect nhi ho raha hai aur sath hi sath E-Mail par bhi mail kar raha hai lekin uska bhi reply nhi aa raha hai, Jiske wajhse Customer bhut paresan hai. Customer ke Home Credit APP me bhi bhut dikkat aa rhi hai Details show nhi kar raha hai App.",1,Detractor,No positive reason,,,,No neutral reason,,,Problem/Issue not resolved by HC|Bad service quality / Problems with service/Bad experience|Others,,Customer care se Baat karna chaho to call connect nhi hota hai.,Yes,Interest rate acha laga tha.,Yes,Customer care par call connect nhi ho rhi hai aur Email ka bhi koi Reply nhi mill raha hai.,"Customer Care par call jaldi connect hona chahiye, E-Mail ka bhi Reply jaldi aana chahiye, aur Home Credit ko apna Application thoda sahi karna chahiye usme bhut si details show nhi kar rhi hai."
10,"easy application process and everything can be arranged online , you don't need to go anywhere",8,Passive,No positive reason,,,,No neutral reason,,,"Expensive fees & Charges - Penalty charges, Bounce charges, late payment charges",,,Yes,"easy online application process , EMI deduct on time",No,,interest rate must be charged on loan amount
10,timly payment aagyi thi home credit mai,10,Promoters,"Affordable Product & Services - Price, fees and terms|Convenient repayment process / collection",,,,No neutral reason,,,No negative reason,,,Yes,customer care service achi hai,No,,no suggestion
9,Updates will be given from time to time,10,Promoters,HC removed my late payment charges/penalty charges|Easily available in shops / Dealer recommendation,,,,No neutral reason,,,No negative reason,,,No,,No,,6 months kakunda 12 months vunte better
7,customer care se baat nhi ho pati /,5,Detractor,No positive reason,,,,No neutral reason,,,High interest rate,,,Yes,easy process,Yes,customer care se baat nhi ho pati / process difficuslt hai customer care contact number connect nhi ho pata,customer care contact hona chaiye improve hona chaiye/ proces fees / interest kam hona chaiye
10,jarurat k time per  loan asani sy mill gya,10,Promoters,Good previous experience / HC resolved my problem|Overall satisfaction – Everything was ok/without problems,,,,No neutral reason,,,No negative reason,,,Yes,customer care support acha laga,No,,no suggestion
10,loan approval jaldi aa jata hain,10,Promoters,Customer care service is good,,,,No neutral reason,,,No negative reason,,,Yes,customer care service is good,No,,no suggestion
9,I got the loan when I needed home credit,9,Promoters,Good previous experience / HC resolved my problem,,,,Will recommend but am not sure whether they will take it or not,,,Bad service quality / Problems with service/Bad experience,,,Yes,I got the loan at the time I needed it and the details were also good,No,,Because the interest rate is very low
8,customer care s contact nhi ho pata/ proper information nahi di,7,Passive,Overall satisfaction – Everything was ok/without problems,,,,No neutral reason,,,No negative reason,,,Yes,emergency me loan asani mil jata hai,Yes,customer care se connect ni ho pata,interest kam hona chaiye
10,customer care sport acha laga,10,Promoters,I received the loan from HC when I was in need|Overall satisfaction – Everything was ok/without problems,,,,No neutral reason,,,No negative reason,,,Yes,online service achi lagi,No,,eak loan amount complet honay per dusra loan jyada amount kar k provide karna chiye customer ko
10,"finance easily mil jata hai,  jaldi approval mil jata hai.",8,Passive,"Application Process - Easy, Fast and Convenient",,,,"Yes, I will recommend the brand to people I know",,,No negative reason,,,Yes,easy process jaldi approval mil jata hai.,No,,interest rate kam kiya jaay.
7,"positive : call alert service is good , negative : there is too much calls",8,Passive,Customer care service is good,,,,No neutral reason,,,No negative reason|Bad service quality / Problems with service/Bad experience,,,Yes,call remind service is good,No,,no suggestion
10,all serivce's is good,9,Promoters,No positive reason,,,,I don’t like to recommend to anyone.,,,No negative reason,,,Yes,Talks nicely to the customer.,No,,"no suggestion.
everything is good."
10,Overall satisfaction,10,Promoters,Quick loan approvals / Higher chances of loan getting approved|Easily available in shops / Dealer recommendation,,,,"Yes, I will recommend the brand to people I know",,,No negative reason,,,No,,No,,no suggestions
10,"online process hai ye acha laga , fast process hai",10,Promoters,"Application Process - Easy, Fast and Convenient",,,,No neutral reason,,,No negative reason,,,Yes,time se phle emi payment ke bare mai inform kar diya jata hai,No,,no sugestion
8,"The higher the interest rate, the lower it should be",10,Promoters,Good previous experience / HC resolved my problem,,,,No neutral reason,,,No negative reason,,,Yes,The loan and everything was approved fastly getting,No,,satisfied this time home credit
5,interest rate thoda jada hai.,5,Detractor,No positive reason,,,,No neutral reason,,,High interest rate,,,Yes,home credit se loan and product lena accha laga.,No,,"no suggestion'
everything is good"
8,over all service is good,7,Passive,No positive reason,,,,No specific reason mentioned by the customer.,,,No negative reason,,,Yes,overall service is good,No,,no suggestion
8,"at the time of forclose the loan , they take too much time for NOC",10,Promoters,Customer care service is good,,,,No neutral reason,,,No negative reason,,,Yes,customer care service is good,Yes,"at the time of forclose the loan , they take too much for provide NOC",interest rate should be reduced
10,loan asani sy mill jata h,10,Promoters,I received the loan from HC when I was in need,,,,No neutral reason,,,No negative reason,,,Yes,jarurat k time loan mill jata h,No,,first loan complet honay par  dusra loan ammount jyada bada kar usko dubara loan provide karna chiye
